Start Time,End Time,Lang ID,Text
0,989,[GER],Die Kommunikation zum Heliport|auf Strebe E ist unterbrochen.
27,472,[ENG],Communications|with the heliport
473,918,[ENG],on the roof of Strut|E have ceased.
27,751,[JPN],E脚屋上ヘリポートとの|連絡が途絶えた
27,918,[FRE],Nos communications avec l'héliport |du toit de l'Etai E ont cessé.
27,472,[SPA],Hemos perdido la comunicación con #ー
473,918,[SPA],el helipuerto que hay en el |tejado del Soporte E.
41,918,[ITA],Le comunicazioni con l'eliporto sul tetto |del Supporto E si sono interrotte.
