Start Time,End Time,Lang ID,Text
0,1253,[GER],Sicherheitsverstoß im Bereich. |Alarm für die ganze Besatzung.
0,640,[ITA],Hanno fatto breccia nella|Sorveglianza di quest'area. 
640,1211,[ITA],Allarme a tutto il personale.
13,1183,[ENG],Security breach in the area. |General alert to all personnel.
13,1197,[FRE],Le système de sécurité a été violé|dans cette zone. Alerte générale !
13,1183,[SPA],Peligra la seguridad en la zona. |Alerta general a toda la sección.
27,389,[JPN],敵がこのエリアにいるぞ
404,682,[JPN],警備を強化しろ
